<?xml version="1.0" encoding="UTF-8"?>
<!-- 
skinType => 0:body; 1:armor 
skinPart => 0:ear;1:eyeL;2:eyeR;3:face;4:foot;5:hair;6:hand;7:lowerBody;8:upperBody; 
-->

<root
    xmlns:xsi='http://www.w3.org/2001/XMLSchema-instance'
    xmlns='http://luoying.huliqing.name'
    xsi:schemaLocation='http://luoying.huliqing.name meta/skin.xsd'>
    
    <!-- ========================================================================= -->
    <!--基本配置-->
    <!-- ========================================================================= -->
    
    <!--人类女性装备-->
    <skinOutfit id="skinHumanFemaleBase" matchAttributes="attributeDead|0,attributeRace|1,attributeSex|1" />
    
    <!-- ========================================================================= -->
    <!--头发-->
    <!-- ========================================================================= -->
    
    <!--头发-->
    <skinOutfit id="skinHair001" extends="skinHumanFemaleBase" icon="Models/actor/female_hair/hair.001.png" file="Models/actor/female_hair/hair.001.j3o" parts="hair"  
                 defence="0"  bindBone="head" cost="800"  />
    <skinOutfit id="skinHair006" extends="skinHumanFemaleBase" icon="Models/actor/female_hair/hair.006.png" file="Models/actor/female_hair/hair.006.j3o" parts="hair"  
                 defence="0"  bindBone="head" cost="800"  />
    <skinOutfit id="skinHair010" extends="skinHumanFemaleBase" icon="Models/actor/female_hair/hair.010.png" file="Models/actor/female_hair/hair.010.j3o" parts="hair"  
                 defence="0"  bindBone="head" cost="800"  />
    <skinOutfit id="skinHair011" extends="skinHumanFemaleBase" icon="Models/actor/female_hair/hair.011.png" file="Models/actor/female_hair/hair.011.j3o" parts="hair" 
                 defence="0"  bindBone="head" cost="800"  />
    
    <!-- ========================================================================= -->
    <!--耳朵-->
    <!-- ========================================================================= -->
    
    <!--普通耳朵-->
    <skinOutfit id="skinEar000" extends="skinHumanFemaleBase" icon="Models/actor/female/ear.000.png" file="Models/actor/female/ear.000.j3o" parts="ear" 
                 defence="0"  bindBone="head" cost="800"  />
    <!--精灵耳朵-->
    <skinOutfit id="skinEar004" extends="skinHumanFemaleBase" icon="Models/actor/female/ear.004.png" file="Models/actor/female/ear.004.j3o" parts="ear" 
                 defence="0"  bindBone="head" cost="800"  />

    <!-- ========================================================================= -->
    <!--眼睛和脸-->
    <!-- ========================================================================= -->
    <!--眼睛和脸-->
    <skinOutfit id="skinEye000" extends="skinHumanFemaleBase" icon="" file="Models/actor/female/eye.000.mesh.j3o" parts="eye"  
                 defence="0"  cost="800"  />
    <skinOutfit id="skinFace000" extends="skinHumanFemaleBase" icon="" file="Models/actor/female/face.000.mesh.j3o" parts="face"  
                 defence="0"  cost="800"  />

    <!-- ========================================================================= -->
    <!--基本身形(内衣身形)-->
    <!-- ========================================================================= -->
    <skinOutfit id="skinFoot000" extends="skinHumanFemaleBase" icon="" file="Models/actor/female/foot.000.mesh.j3o" parts="foot"  
                 defence="0"  />
    <skinOutfit id="skinHand000" extends="skinHumanFemaleBase" icon="" file="Models/actor/female/hand.000.mesh.j3o" parts="hand"  
                 defence="0"  />
    <skinOutfit id="skinLowerBody000" extends="skinHumanFemaleBase" icon="" file="Models/actor/female/lowerBody.000.mesh.j3o" parts="lowerBody"  
                 defence="0"  />
    <skinOutfit id="skinUpperBody000" extends="skinHumanFemaleBase" icon="" file="Models/actor/female/upperBody.000.mesh.j3o" parts="upperBody"  
                 defence="0"  />

    <!-- ========================================================================= -->
    <!--套装-->
    <!-- ========================================================================= -->
    
    <!--精灵风衣-->
    <skinOutfit id="skinFoot001" extends="skinHumanFemaleBase" icon="Models/actor/female/foot.001.mesh.png" file="Models/actor/female/foot.001.mesh.j3o" 
                parts="foot"   cost="800" 
                applyAttributes="attributeDefence|3,attributeMagicDefence|3" sounds="soundDressOutfit" />
    
    <skinOutfit id="skinHand001" extends="skinHumanFemaleBase" icon="Models/actor/female/hand.001.mesh.png" file="Models/actor/female/hand.001.mesh.j3o" 
                parts="hand"   cost="800" 
                applyAttributes="attributeDefence|3,attributeMagicDefence|3" sounds="soundDressOutfit" />
    
    <skinOutfit id="skinLowerBody001" extends="skinHumanFemaleBase" icon="Models/actor/female/lowerBody.001.mesh.png" file="Models/actor/female/lowerBody.001.mesh.j3o" 
                parts="lowerBody"   cost="800" 
                applyAttributes="attributeDefence|7,attributeMagicDefence|3" sounds="soundDressOutfit" />
    
    <skinOutfit id="skinUpperBody001" extends="skinHumanFemaleBase" icon="Models/actor/female/upperBody.001.mesh.png" file="Models/actor/female/upperBody.001.mesh.j3o" 
                parts="upperBody"   cost="800" 
                applyAttributes="attributeDefence|7,attributeMagicDefence|3" sounds="soundDressOutfit" />
    
    <!--机动铠甲-->
    <skinOutfit id="skinFoot002" extends="skinHumanFemaleBase" icon="Models/actor/female/foot.002.mesh.png" file="Models/actor/female/foot.002.mesh.j3o" 
                parts="foot"   cost="800" 
                applyAttributes="attributeDefence|2,attributeMagicDefence|1" sounds="soundDressOutfit" />
    
    <skinOutfit id="skinHand002" extends="skinHumanFemaleBase" icon="Models/actor/female/hand.002.mesh.png" file="Models/actor/female/hand.002.mesh.j3o" 
                parts="hand"   cost="800" 
                applyAttributes="attributeDefence|2,attributeMagicDefence|1" sounds="soundDressOutfit" />
    
    <skinOutfit id="skinLowerBody002" extends="skinHumanFemaleBase" icon="Models/actor/female/lowerBody.002.mesh.png" file="Models/actor/female/lowerBody.002.mesh.j3o" 
                parts="lowerBody"   cost="800" 
                applyAttributes="attributeDefence|5,attributeMagicDefence|2" sounds="soundDressOutfit" />
    
    <skinOutfit id="skinUpperBody002" extends="skinHumanFemaleBase" icon="Models/actor/female/upperBody.002.mesh.png" file="Models/actor/female/upperBody.002.mesh.j3o" 
                parts="upperBody"   cost="800" 
                applyAttributes="attributeDefence|5,attributeMagicDefence|2" sounds="soundDressOutfit" />
    
    <!--绿色工作服-->
    <skinOutfit id="skinFoot003" extends="skinHumanFemaleBase" icon="Models/actor/female/foot.003.mesh.png" file="Models/actor/female/foot.003.mesh.j3o" 
                parts="foot" cost="800" 
                applyAttributes="attributeDefence|2,attributeMagicDefence|1" sounds="soundDressOutfit" />
    
    <skinOutfit id="skinHand003" extends="skinHumanFemaleBase" icon="Models/actor/female/hand.003.mesh.png" file="Models/actor/female/hand.003.mesh.j3o" 
                parts="hand" cost="800" 
                applyAttributes="attributeDefence|2,attributeMagicDefence|1" sounds="soundDressOutfit" />
    
    <skinOutfit id="skinLowerBody003" extends="skinHumanFemaleBase" icon="Models/actor/female/lowerBody.003.mesh.png" file="Models/actor/female/lowerBody.003.mesh.j3o" 
		parts="lowerBody" cost="800" 
                applyAttributes="attributeDefence|5,attributeMagicDefence|2" sounds="soundDressOutfit" />
    
    <skinOutfit id="skinUpperBody003" extends="skinHumanFemaleBase" icon="Models/actor/female/upperBody.003.mesh.png" file="Models/actor/female/upperBody.003.mesh.j3o" 
		parts="upperBody" cost="800" 
                applyAttributes="attributeDefence|5,attributeMagicDefence|2" sounds="soundDressOutfit" />

    <!--妖精装-->
    <skinOutfit id="skinFoot004" extends="skinHumanFemaleBase" icon="Models/actor/female/foot.004.mesh.png" file="Models/actor/female/foot.004.mesh.j3o" 
		parts="foot" cost="800" 
                applyAttributes="attributeDefence|3,attributeMagicDefence|3" sounds="soundDressOutfit" />
    
    <skinOutfit id="skinHand004" extends="skinHumanFemaleBase" icon="Models/actor/female/hand.004.mesh.png" file="Models/actor/female/hand.004.mesh.j3o" 
		parts="hand" cost="800" 
                applyAttributes="attributeDefence|3,attributeMagicDefence|3" sounds="soundDressOutfit" />
    
    <skinOutfit id="skinLowerBody004" extends="skinHumanFemaleBase" icon="Models/actor/female/lowerBody.004.mesh.png" file="Models/actor/female/lowerBody.004.mesh.j3o" 
		parts="lowerBody" cost="800" 
                applyAttributes="attributeDefence|6,attributeMagicDefence|6" sounds="soundDressOutfit" />
    
    <skinOutfit id="skinUpperBody004" extends="skinHumanFemaleBase" icon="Models/actor/female/upperBody.004.mesh.png" file="Models/actor/female/upperBody.004.mesh.j3o" 
		parts="upperBody" cost="800" 
                applyAttributes="attributeDefence|6,attributeMagicDefence|6" sounds="soundDressOutfit" />

    <!--战士装-->
    <skinOutfit id="skinFoot005" extends="skinHumanFemaleBase" icon="Models/actor/female/foot.005.mesh.png" file="Models/actor/female/foot.005.mesh.j3o" 
		parts="foot" cost="800" 
                applyAttributes="attributeDefence|3,attributeMagicDefence|2" sounds="soundDressOutfit" />
    
    <skinOutfit id="skinHand005" extends="skinHumanFemaleBase" icon="Models/actor/female/hand.005.mesh.png" file="Models/actor/female/hand.005.mesh.j3o" 
		parts="hand" cost="800" 
                applyAttributes="attributeDefence|3,attributeMagicDefence|2" sounds="soundDressOutfit" />
    
    <skinOutfit id="skinLowerBody005" extends="skinHumanFemaleBase" icon="Models/actor/female/lowerBody.005.mesh.png" file="Models/actor/female/lowerBody.005.mesh.j3o" 
		parts="lowerBody" cost="800"